{
    "id": 1,
    "cart_key": null,
    "pre_order_id": "サンプルpre_order_id",
    "total_price": 1000,
    "delivery_fee_total": 1000,
    "sort_no": 1,
    "create_date": "2024-01-01T00:00:00+09:00",
    "update_date": "2024-01-01T00:00:00+09:00",
    "customer": {
        "id": 1,
        "name": "サンプルCustomer"
    },
    "cart_items": [
        {
            "id": 1,
            "name": "サンプルCartItem"
        }
    ]
}